What it Takes to be a Top Entrepreneurï¼š A Lesson from Baseball,"Tell a lot of founders, one of the best baseball players ever just retired for the St. Louis Cardinals, Albert Pujols. I think he's number five overall in the history of baseball. His batting average is 296, which means out of a thousand times, he would get a hit 296. So we talk about, you know, more than 50% hit right now in baseball to be one of the best ever. You have to have 30% of the time successes. And I think in entrepreneurship, it might be even lower, you know, like if you get a couple things really right. So you, you can make a lot of mistakes. And, and I think it's important to embrace that and get really comfortable and actually enjoy making the mistakes.","Albert Pujols, one of the best baseball players, has retired. His batting average of 296 is considered impressive. Mistakes are important in entrepreneurship."
What kind of businesses should be raising moneyï¼Ÿ #investing #funding,"Curious of what kinds of businesses should be raising money and what kinds of businesses shouldn't? There's two questions. There's a question personally, which is the most important one, I think, and then there's a question about the business. And the sub questions personally are, what do you want your life to be like in 5 or 10 years? Do you want to be the king and own it and run it and make the calls? Or do you want to kind of have something potentially bigger and more meaningful, but like have a board and have this kind of structure where you're essentially working for the company? I think that there's like a big difference there personally. I think also personally, it's like, how much money do you need? And how much do you have? And how much can you in either case, let's say you don't have very much money. Well, that's either a reason to start a very cash flow oriented business or a reason to raise money.",The transcript discusses the importance of personal goals and financial needs when deciding whether to raise money for a business.
What to Do When Feeling Overwhelmed,"Is there anything you do to try to recenter yourself? Yeah, I try to go to gratitude. That's probably like the thing I've been doing the last couple days is just like being in gratitude. I mean, there's always there's the behaviors of like heroing oneself, which is like, Oh, it's fine, suck it up and deal with it. There's the thing of like, Oh, I don't want to feel like this and like fighting that. So I was like, No, this is where this is where we are right now. That's okay. But I try I try to have gratitude and then and then if it gets too intense, like I make changes.","The speaker tries to recenter themselves by practicing gratitude and accepting their current state, but also makes changes if the intensity becomes too much."
When To Give Up On Your Startup,"If you're a new founder starting out, I typically say, like, give yourself two years. Two years is a long time if you're giving it your all every day. So if you don't have anything going interesting within two years, then probably you should do something else.",The transcript advises new founders to give themselves two years to see if their venture is successful before considering other options.
When to start your businessï¼Ÿ What side hustle to pickï¼Ÿ,"If you start straight out of university without any income, without any savings, to try and start your own business, then you've got to learn all those lessons at the same time as trying to make money. We were glorified by some people that go drop out of university and do it straight away. We had tried side hustles even in college. We were like, oh, we were that kid that was like, we're going to go straight out of college. And I don't think we understood what it really took. And it just never worked for me.",Starting a business straight out of university without savings or income is challenging. Side hustles in college didn't prepare them for the reality.
Why a Repeatable Process Isn't Always Necessary for Launching Businesses,"Do you feel like you've figured out a repeatable process at this point and structure for this venture studio? I don't think I have, and I'm not sure that you should. I do have a high level process that I put together when I was at Ampush with my co-founder there that I call the entrepreneurial loop. It's pretty wide and it's like our version of OKRs almost. So it's like you put together a desired future state. What do you want in the future? Then you put together where you are today and you make sure that the stretch is reasonable, like it's not too much, it's not too little. Then you put together, there's this concept of waypoints, which we really like, which is it's a sailing analogy. I'm not a sailor, but apparently if you were to sail from San Francisco to India, you don't just do it in a straight line. You first go here, then you go here, then you go here. So we spent a lot of time, OK, what's the next most important thing we need to get going? And so it's really kind of gating, you know, whatever you want to call them, like stage gating or like a video game. It's like levels. But we're really big on kind of figuring those out.","The speaker discusses their process for their venture studio, which involves setting a desired future state, assessing the current state, and identifying important milestones along the way."
Why A Venture Studio v1,"What is your journey to like get into doing Adventure Studio? My journey towards it was very much rooted in coaching. It became clear to me that one time my coach asked me, what's the one thing you can't not do? And his theory is it's already something you do. It's so inherent to who you are, but you probably haven't spotted it yet. You know, if you bring it into a room with you, every podcast, every tweet has a piece of it in you. What is that thing, Jesse? And I sort of said it was like to help people raise the bar and like level themselves up. And I use entrepreneurship as a canvas to do it. And you could use sports to be the canvas. Like there's a million ways to get better, to improve yourself. And I happen to use entrepreneurship. That's the one I love. And I was like, so I was like, well, if I wanted to do that in an extreme way, what is the organization that would support that best?",The speaker's journey to Adventure Studio was rooted in coaching and a desire to help people raise the bar and level themselves up through entrepreneurship.
Why Do Consultants Existï¼Ÿ,"Sometimes people ask that question, why do consultants even exist? And the reason is because everyone has a day job at big companies and small companies. Everyone's got a day job, and it's actually helpful to have someone who's not in your day to day come in from the outside, look at what you're doing and help you with something, especially in a world where technology has changed. AI has, okay, now there's this new AI thing, what do I do about it?",Consultants exist to provide outside perspective and help companies navigate new technologies like AI.
Why Luxury Brands are More Successful Than Venture Funded Companies,"What I like about these luxury brands and I think why they're so successful is they're the opposite of venture-funded companies, you know They cannot force growth. By definition if they force growth They will stop being a luxury brand and there's obviously the famous stories about Bernard Assault and LVMH And you know, he realized that early on so he had to like buy other brands because you cannot force You can't go just multiply the number of SKUs in order to grow And so I think what I like about them is I think they build great businesses over a long period of time Because they're they're basically profitable from the beginning and and they take their time to grow and scale","Luxury brands are successful because they prioritize organic growth and profitability, unlike venture-funded companies that force growth through increasing SKUs."
Why My Friends Don't Understand My Business Goals,"All my friends are like, well, why don't you focus on one and make that one, you know, and it's like, I just tell my friends, you know, my business, I'm like, my goal is not profit, you know, expected value maximization, my goal is like life enjoyment. And I said, So in that sense, yes, you're right, I'm probably leaving 20% of the table here. But I'm having much more fun every day. And that's much more important to me.",The speaker prioritizes life enjoyment over profit and acknowledges that they may be leaving potential gains on the table.
Why Raising Money Can Be a Double-Edged Sword for Entrepreneurs,"I always looked at preferred capital in my cap table as debt, because in a downside scenario, that's the first money out, right? That's the way it works. And, you know, I think the right time to raise money, like when people talk about this, one thing I always say to certainly early entrepreneurs, I go, it's your choice. If you want to own 6% or 7% of your business and have, you know, be effectively a high paid employee, because you can, you'll own a lot and you'll have a good salary, you're going to learn from a bunch of VCs or fine people, whatever, they know how to build businesses and grow them. Their goal is you're not aligned, their interests are misaligned. If on the flip side, you want flexibility and you want to run a business for as long as you want, and you don't want, in a downside scenario, you're still going to do all right, because you know, there's not, you don't have to clear any capital.",The speaker discusses the choice between raising money and giving up ownership or maintaining flexibility and running a business independently.
Why St. Louis Beats Out the Big City.,"St. Louis is better than New York City. Here's five reasons why. Reason number one, the real estate is so much cheaper. For $500,000 in St. Louis, you can get a beautiful three-bed, three-bath, 2,500 square feet. In Brooklyn, you could barely get 600 square feet. Reason number two, St. Louis has better food. Emo's pizza, that delicious Provel cheese, the thin crust, better than any New York slice any day of the week. And don't get me started on the bagels. Reason number three, the St. Louis Cardinals are way better than the New York Yankees. We don't buy our way to winning, we have a culture of winning. Reason number four, the people are all nice in St. Louis. You walk by and they look at you and they say good morning and hello. Number five, and most importantly, we're much further from New Jersey.","St. Louis is better than New York City due to cheaper real estate, better food, superior baseball team, friendly people, and distance from New Jersey."
Why â€œI Donâ€™t Knowâ€ Is a Powerful Phrase for Entrepreneurs,"for a first time entrepreneur, or even a serial entrepreneur, if they feel like they haven't quite figured out product market fit, a lot of people will get panicked about it because they're like, shit, like this whole grand plan I had, what do I do now? And you seem very calm about it. There's some real reasons I have other success and other businesses and push, we have plenty of money in the bank economy. So we have time, which is the most important variable here. But I think the other reason is I did not start this journey saying I know the answer. And I think it's so important for any entrepreneur listening. It's like they call the concept the beginner's mind. When we started going, I was like, I don't know what verticals this is going to work for. I think that's the most important thing is I don't know is a really powerful statement and phrase. Transcribed by https://otter.ai","The speaker emphasizes the importance of not panicking when a business hasn't found product-market fit yet, and highlights the value of having a beginner's mindset and being open to not knowing the answer."
Working With Meï¼š A Warning,i can be a little intimidating i don't mean to be intimidating but i'm direct and i'm you know i'm smart and i'm fast and so like if you're gonna be in that meeting with me and you're not prepared it's gonna not be on your game it's not gonna be very pleasant for you,"The speaker admits to being intimidating due to their directness, intelligence, and speed. They warn that being unprepared in a meeting with them will not be pleasant."
You CAN make millions on TikTok! ðŸ’°  #entrepreneurship #money #business,"This is one of my favorite stories about TikTok. You guys know this woman, I don't know her name, but there's like two things I like that are so weird. One is Excel. And the other one is like, I love trap music and gangster rap hip hop. And so this woman is doing like shortcut. The whole TikTok channel is, I'm going to show you shortcuts while like Drake or Tupac are blasting. And apparently she makes like several million dollars a year. She's printing money. She's printing money.",A woman on TikTok makes millions of dollars a year by showing shortcuts while playing trap music and gangster rap.
"You don't have a discipline problem, you have an energy problem. Here's how to fix it.","You don't actually have a discipline problem. What you have is an energy problem. Here are four ways to think about managing your energy a little bit better. Number one, work like a lion, not a cow. Most of us have been taught, let's wake up, let's go nine to five, sit at a desk, do the same thing over and over. People who focus on their energy think about when they get the most done and they work during those times, just like a lion waits to go get its prey. Find your zone of genius. There's actually four zones. The zone of incompetence. That's stuff you don't know how to do. The zone of competence, stuff you know how to do, like maybe drive a car. Zone of excellence. For me, that might be spreadsheets. But zone of genius is something that not only am I good at, like the zone of excellence, but also gives me energy. Think yes and not either or. And last but not least, make sure that you're enjoying the people you work around. When you work with people you love, it's just fun every day and you don't have to worry about.","Managing energy is key to productivity. Focus on working during your most productive times, find your zone of genius, think yes and not either or, and enjoy working with people you love."
You need to FAIL to become successful in business! ðŸ’° #entrepreneurship #money,"Baseball, to be one of the best ever, you have to have 30% of the time successes. And I think in entrepreneurship, it might be even lower, you know, like if you get a couple things really right, so you can make a lot of mistakes. And I think it's important to embrace that and get really comfortable and actually enjoy making mistakes.","To succeed in baseball or entrepreneurship, one must embrace making mistakes and learn from them. Success rates may be even lower in entrepreneurship."
