How I Made $1000 a Month as a Teenager,make a thousand dollars a month as a teenager doing this. when i was 13 my brother and i saw the snow outside and realized there was a huge opportunity going door to door and asking people to snow shovel their driveways. after the first day of doing it we cleared a few hundred dollars pretty easily. then the light bulb went off in our head. we realized that whether you had a huge driveway or a small driveway you'd probably pay about 20 or 30 dollars for someone to come and snow shovel it. so we had our mom drive us to a neighborhood with a bunch of small driveways and what made us a few hundred dollars earlier we made over a thousand dollars shoveling driveways in the same amount of time.,Two teenagers made over a thousand dollars a month by going door to door and shoveling driveways during the winter.
How I Made Thousands of Dollars as a Teenager,"Here are three ways I made thousands of dollars as a teenager. The first business I started was snow shoveling. My brother and I would go to the neighborhood with the smallest driveways, shovel them up as quickly as we could, charge $20 to $30 each, and made a ton of money doing it. The second business was being a DJ. Weddings, graduations, anyone who needed something, we would have the music ready to go, and we'd do $500 a night to DJ. The third one was in college I started a t-shirt business. We helped fraternities and sororities get their t-shirts printed for date parties and made a boatload of money.","As a teenager, the speaker made thousands of dollars through snow shoveling, DJing, and running a t-shirt business."
How increase profits on your e-commerce websiteï¼Ÿ Kahani App. #shopify #dropshipping #money,"We're looking at e-commerce websites and they haven't changed in 10 or 15 years. We just think they're boring, they're old. And we asked ourselves the question, who's really good at engaging you on mobile because these websites look just old and tired and the obvious answer was TikTok, Instagram. And so we said, what would happen if you could actually redesign the e-commerce experience to look and feel like TikTok and Instagram, and that's what Kahani is. We give software to e-commerce retailers that make their entire site interactive. So you can swipe, you can tap just like you're on TikTok or Instagram, but you're actually on a website URL.","Kahani is a software that aims to redesign e-commerce websites to be more engaging and interactive, similar to TikTok and Instagram."
How McKinsey Taught Me the Magic of Offshoring,"Here's how I first learned the magic of offshoring. At the age of 22, I worked at McKinsey and Company, and was working on my slides until late in the night. My manager looked over my shoulder and said, hey Jesse, you should send those to India. You can just draw them up on a page, and they'll make those slides for you, and they'll be in your inbox the next day. And so I did it, and the first time I ever did it, it was like magic. That led me to realize the value and power of offshoring. When I started Ampush, my first company, one of the first hires I made was a small team in India who helped me make and create Facebook ads and upload them. Fast forward 10 years, and I realized that was a service that any brand or agency should have, and I started Growth Assistant. Growth Assistant essentially allows any brand or agency to have an awesome offshore marketing team, and they take on the important, but more manual and rote tasks inside the business. We started the business two years ago, and we have over 300 people already in the Philippines working with 100 brands and agencies.","The speaker learned the value of offshoring while working at McKinsey, leading them to start Growth Assistant, a service that provides offshore marketing teams to brands and agencies."
How to Avoid Being a Victim of Change in Your Business,"I think the best organizations, you know, they're reorganizing their companies every nine months, right? I mean, McKinsey is an extreme example, moves everybody around every three months. Like they're all on new projects. And so like the best organizations are constantly moving people around and changing things up because they start to actually be drivers of change, not victims of change.",The best organizations constantly reorganize and move employees around to become drivers of change rather than victims.
How to find motivationï¼Ÿ Identify these 5 frameworks. #motivation #success  #mindset,"There's five types of motivators. There's fear, there's extrinsic, there's intrinsic, there's play genius, and then there's like empathic love, right? And fear is could be anything from I don't think I'm much highly of myself. So I have to prove that I'm a certain way. In my case, it was I don't think I'll be successful. Like I wanted to be successful so badly. And I didn't think I would be. And so I would just use that gap to constantly motivate myself. Fear is very effective, right? You put a gun to my head, I'll run faster than I've ever run. But then as soon as the guns gone, I stopped running.","The transcript discusses five types of motivators: fear, extrinsic, intrinsic, play genius, and empathic love. Fear is effective but temporary."
How to find your purpose in lifeï¼Ÿ Most people don't get it. #business #lifehacks #business #mindset,"We make finding purpose a threatening experience. Because we say, what is my purpose? Oh, I need a purpose. I must have a purpose. Why don't I have a purpose? Whatever your purpose is, it's actually a form of being. It's just being who you are. And so, like, your purpose is not a thing you go get. It's already with you. The second part of it was, by the way, you probably demonstrate your purpose on a regular basis. You just haven't kind of put your finger on it just yet. What's the one thing you can't not do?","The purpose is not something to be found or obtained, but rather a form of being. It is already within you and is demonstrated regularly in your actions."
How to Have an Infinite Runway for Your Business,"How do you think about building businesses? I've always kind of been obsessed with bootstrapping and kind of starting and generating a profit. And the reason was there's something that never quite sat well with me about I take money and I'm burning it and I have like an end date. Like I have this thing called a runway that I will eventually drive off of. And one thing I've often said to people at any stage of their company, just get to one dollar a month in profit, because if you're in one dollar a month in profit, your runway becomes infinite.",The speaker emphasizes the importance of bootstrapping and generating profit to avoid burning through funding and having a limited runway.
How to invest your moneyï¼Ÿ ðŸ’°#entrepreneurship #business #investing,"And I generally have four buckets. First is index funds. The second one is I think there's a certain stock picking things I'll do where I believe the business itself can compound over a very long time. And 10 years ago for me, that was Google, Facebook, Amazon, MasterCard, Visa. And that just crushed it. The next 10 years, I think it's companies like Twilio, Shopify, a handful of other ones. The third bucket is real estate. And then the fourth one is like angel or venture stuff.","The speaker has four investment buckets: index funds, long-term stock picks (Google, Facebook, etc.), real estate, and angel/venture investments."
How To Maintain Friendships While Building a Business,Nick and I realized at some point we had to like create time for our friendship as we were building and push because you Know every time we talked something about the business would come up right it was natural nobody meant for it And it's been interesting now that we sold and put him and I are just friends now like literally just friends We have a couple of joint investments in a couple like we have no business talk very little business talk and our friendship is kind Of like regrowing. It's just interesting. It's a good thing to call out for people who work with friends Which is like I'll make time for the friendship,"The transcript discusses how the speakers had to make time for their friendship while building a business, but now that they have sold it, their friendship is regrowing without much business talk."
"How to make $1,000,000, find your unfair advantage #entrepreneurship #money #business","how to make a million dollars in the next 12 months. There's things you know that nobody else knows. Somebody listening right now. Sikhs who know e-commerce, like, I don't know, I'm one of like five in the world probably, right? Like I can start a turban e-commerce business. I start with what is my unfair advantage? What is something I know that other people don't know? And then I go, who can I charge the most money to who would benefit from this thing that I know?",The transcript discusses the strategy of making a million dollars in the next 12 months by leveraging unique knowledge and targeting specific customers.
How to pick the right business ideaï¼Ÿ #business #entrepreneur #ecommerce  #wealth,"What gets me excited? We have a bunch of ideas. Which one do I keep finding myself research? Or when I talk about it, I light up or I become excited about it. You have to follow that. I think it's important to follow that energy of an excitement. Brainstorm a bunch of a list of different things. Flush them out with some competitive and customer validation research. See which ones you have an unfair advantage in starting and then choose based on your energy and excitement for that idea.","It is important to follow the energy and excitement when choosing an idea to pursue, after brainstorming and validating different options."
"How To Work Smart, Not Hard","How did you decide what you did versus what you like paid other people to do? Yeah, I'm like kind of lazy and not really a doer. Certainly not anymore because I'm old. I'm an old man. But I think that I am actually very good at holding people accountable and sort of like keeping pace with things and ensuring things are getting done in a certain way. But like some of it is like where is my genius going to add value to this? I think that's probably the biggest question I ask.","The speaker discusses their preference for delegating tasks and their ability to hold others accountable, while considering where their expertise can add value."
How We Got The Idea for a 7 Figure Business,"You guys have narrowed down around marketing and you've narrowed down around the Philippines. And like, was this where you started or did you start with something else? No, it's been like pretty straightforward from the get go. I mean, and really it started at Ampush. You know, my first company, we had built our own offshore team and we'd have all these folks who would spend two or three years at Ampush, then go work in house at a brand and they'd call me and go, can I use that, that, that team? And we'd say, well, no, you'd have to be a client of Ampush to have access to that. And so as I started building GatewayX, it was like, this idea was at the top of the list, but it's, it's been a model where we embed people in the teams. We're paying attention to their training and making sure that they're top notch. But I think the most unique thing about it has been the training and the embedded model. So it's like somewhere I was described as somewhere between Upwork, which is very project based and one-off and a normal full-time employee, which is expensive. So they're full-time, they're embedded, they're on the team, they know the context, but they're able to get a lot of these kinds of tasks and work done that are really, really valuable.","GatewayX offers embedded marketing teams in the Philippines, providing training and valuable work at a lower cost than full-time employees."
I started Ampush when i was 25 and bootstrap it to 30m in revenue. #business #entrepreneur #money,"I started Ampush when I was 25. We grew the business super hard, super aggressive, bootstrapped it to 30 million in revenue in four or five years and killed ourselves doing it. I mean, it was rough. I killed other people too, all the while having great good intentions, let's say. Do you think there are people that still dislike you from Ampush? I'm sure. When I look back on it, I go, oh yeah, okay, I see. I see how I created that. We sold a big chunk of the company, had the success check mark, quote unquote. I had this period after my daughter was born where I just didn't want to go to work for probably six months. Jesse, you're the luckiest MF-er in the world. There's some inner work to be done.","The founder of Ampush reflects on the aggressive growth of the company, acknowledging the negative impact it had on others and expressing a desire for personal growth."
Is Work-Life Balance Possible in Management Consultingï¼Ÿ,"When I did management consulting, I would not describe what I had as a work-life balance. I was 22, you know, you're traveling four days a week. The good weeks were 60 hours, the bad weeks were 80 or 90. I learned a ton, which was really fun and got to work with a lot of great people. But yeah, I don't think, you know, at that age I wasn't... I also wasn't really looking for work-life balance. If anything, my roommates were doing investment banking and they were like, dang, you have an easy life, man. You're just chilling relative to what they were putting in.","The speaker reflects on their experience in management consulting, describing long work hours and a lack of work-life balance."
"Mark Zuckerberg first interview, how we try to make Facebook for High Schools back in 2006 #tech","How did you call Mark Zuckerberg? Explain that story. 2005, he was some junior at Harvard. Facebook was in 10 colleges or 20 colleges. We were very entrepreneurial and we were like, let's start a high school version of Facebook. Well, we're like, what should we call it? Let's call it HS Facebook. And so we find who owns hsfacebook.com. And it was some other kid who was the same age as us at Columbia. He was like, I want 20 grand for it. We're like, we don't have 20 grand. We called the business, the high list.com built the whole thing. We launched it. It actually, we started to see all the same trends of virality. He pings us and goes, Mark Zuckerberg wants to buy HS Facebook. Apparently they're launching in high schools. Tons of fear. Like the next two days we were paralyzed, have to figure out if it's true. Like what if the guy is just BSing us to get us to buy his domain, prove it. And he forwards us an email from him. And it's an email from Mark Zuckerberg with Mark Zuckerberg's cell number.","In 2005, the speaker and his team created a high school version of Facebook called HS Facebook. They were approached by Mark Zuckerberg who wanted to buy it."
Meeting with your tax advisors on a monthly basis #entrepreneur #business #taxes #income,"I meet with my tax advisors every other week, throughout the year. Every other week? If there was some part of your business, Alex, that's worth 20 to 40% of what you're going to ultimately achieve, wouldn't you manage it at least every other week? I mean, everything else, every other part of it, the advertising sales, the this, the that, you manage daily or weekly. And somebody said that to me once. I wasn't doing that, and I was like, oh yeah, you're right. And so I'll tell them what's going on in the business, I'll give them an update on this.","The speaker meets with tax advisors every other week, realizing the importance of managing this aspect of their business regularly."
"Motivationï¼Ÿ Have unrealistic goals, exceed your dreams #business #entrepreneurship #motivation","If I don't have a big target, I need to hit, how am I going to get out of bed in the morning because I need this fear. And, and at one point he said to me, he goes, Jesse, what are you afraid of? Is it going to happen? If you don't give yourself some huge market cap or revenue number to go hit. And I go, I don't know. What if I like watch Netflix all day and I just don't do shit. And he goes, do it. He goes, go, I want you to take a week off work. I did it, you know, after three days, I was like, this is boring. I want to go do some interesting stuff. He goes, what you see is that you're still a creative guy who wants to go build stuff. You don't have to use fear as the thing to get you to do that.","The transcript discusses the importance of having a big target or fear to motivate oneself, but also highlights the possibility of finding motivation through personal interests and creativity."
Mr Beast is raising $150 million at a 1.5b valuation #youtube #wealth #business #socialmedia,"Axios reported a few days ago that Mr. Beast is raising $150 million for his business, $1.5 billion valuation, and this is across his whole business. I don't think about Disney and Jimmy all that differently. I think the Disney analogy is very apt. Do you know what year Snow White was made in? I'm going to guess 1940. 1947. 1937. My daughter can name all the dwarves, so can most people. Media has a crazy, I mean, it's the original software business. I probably wouldn't invest because it's not my profile of an investment, but if I was a private equity guy, I would definitely invest. Like, if I was using a fund and had that kind of return profile, I would definitely invest.","Mr. Beast is raising $150 million for his business, with a $1.5 billion valuation. The Disney analogy is fitting, as media is a lucrative industry."
My Biggest Lesson From Working at McKinsey and Goldman Sachs,"My biggest lesson working at McKinsey and Goldman Sachs was to maintain a really high bar for hiring. Both companies are notorious for long interview processes, quantitative questions, psychological questions, and what I realized being a part of that experience and then watching what it did is once you had really bright people on the other side of that filter, you could get anything done fast and effectively. It's something I've brought with me in all my entrepreneurial ventures since then.","Maintaining a high hiring standard is crucial for success, as observed by the speaker's experience at McKinsey and Goldman Sachs, where talented individuals led to efficient and effective outcomes."
My Biggest Unfair Advantage as an Entrepreneur,"Here's one of my biggest unfair advantages, having immigrant parents, especially immigrant entrepreneur parents. When I grew up, my dad was 24. He had two young children. And from the time I could remember, he was an entrepreneur. One thing I remember very distinctly was he never talked about having an employer, he never talked about having a boss, his mindset was to be the owner to run the business. And that left a huge imprint on me, even as I was working at fancy jobs at McKinsey and Goldman Sachs, I still knew I wasn't owning the business and running it. And so having that mentality brought in in a really early time really shaped me in unique ways.","Growing up with immigrant entrepreneur parents gave the speaker a unique advantage, as their mindset of being the owner and running a business left a lasting impact on them."
My Vision for Gateway X,"The desired future state for GatewayX and my dream is a bunch of companies operating under one sort of common culture and common way of doing things. Really focused on launching new ventures when we have the good ideas and we have the right people. And we're teaching and coaching people on how to be the best versions of themselves. Uh, and, and we're, we're growing and scaling the business. So rather than joining McKinsey or Goldman Sachs out of college, you joined GatewayX where you're going to learn how to run a business. We're going to scale you and teach you a bunch of different things. And eventually you'll start your own business under our umbrella.","GatewayX aims to create a unified culture and approach, focusing on launching ventures, coaching individuals, and scaling the business. It offers an alternative path for individuals to learn how to run a business and eventually start their own."
Overcoming Perfectionism and Taking Action to Start Your TikTok Marketing,"What advice would you give to someone in your shoes just getting started in marketing to potentially approach a platform like TikTok? The biggest, best piece of advice I can give someone similar to Twitter is just do it. Get engaged into it. Stop worrying about whether you're doing it right. Stop asking people for, you know, the perfect advice. Not to say you shouldn't ask for advice, you can definitely ask people, but a lot of people use that as a way to just not try it and do it. And like start making TikToks, start posting things onto the page, and really get to know and get to understand the platform.","The advice for someone starting in marketing on TikTok is to just do it, stop worrying about doing it right, and start making TikToks to understand the platform."
Performance marketing was our tool to make money quickly #business #entrepreneurship #money,"We wanted something that would make us money quickly. We'd also learn from it. And so someone said, go look at digital marketing. And there's this type of marketing called performance marketing. They'll just pay you for every successful customer you drive for them. Okay. Cost you $25 on Google to buy the AdWords and then you can sell it for 50. You make 25, you know, it was super naive. We said, Oh, that sounds great. We can figure that out. And then of course, reality, you know, met us where we said, Oh my God, we don't know how to run an AdWords campaign. We don't know how to set up a website. And eventually we, I think we really just copied like a competitor's landing page and a competitor's keywords. And it started to make a small margin, like a five or 10% margin.",The speaker initially saw potential in performance marketing but quickly realized they lacked the necessary skills and knowledge to succeed.
Scary Times Bring Opportunitiesï¼š Learn from 2008,"I joined Goldman Sachs three months before Lehman filed for bankruptcy. It was one of the scariest times to be a working professional on Wall Street, in tech, or anywhere else. But something happened the year before that was even more important, and that was the iPhone launching. As we know, because of the iPhone launching, businesses like Uber, Zynga, and many many others launched on the back of that technology. Today, we have another scary situation. There's high inflation, and it feels like we're slowing down. And I believe that AI and some of the AI tools we're seeing are going to be the next version of the iPhone. Are you building against them?",The transcript discusses the impact of the iPhone launch on businesses and predicts that AI tools will be the next game-changing technology.
Should you focus on 1 business or try multiple ideasï¼Ÿ This is what I do. #business #entrepreneur,"All my friends are like, well, why don't you focus on one and make that one? And I have to tell my friends, my goal is not profit expected value maximization. My goal is like enjoyment and purpose. And I said, so in that sense, yes, you're right. I'm probably leaving 20% on the table here, but I'm having much more fun every day. I think your friends are wrong for me, at least.","The speaker's friends question why they don't focus on one thing for profit, but the speaker values enjoyment and purpose over maximizing profit."
Stop Asking for Permission,"People don't want to get in trouble, like they don't want to do something wrong. They don't want to make a mistake. But it's you realize actually how much organizational inertia and slowness sets in because of that one issue, which is like, I'm going to wait for permission and not ask for forgiveness. And I've been kind of going around and kind of going like, hey, stop asking for permission.",The speaker highlights the negative impact of seeking permission and encourages people to stop asking for it to avoid organizational inertia and slowness.
Strategic Planning v1,"Jesse, how do you go about planning for your businesses? The way I think about it, everything starts with what we call a desired future state and desired future state is this future vision that you think is what you want. Where do I want to be? And the point of the DFS is forcibly disconnect people from reality. We actually want that. We want people to have an open and big vision. The more vivid you can make that future vision, the better. Here's what I hope the revenue and EBITDA look like. Here's what I think my headcount will look like. Here's the offerings I want to have. Here's what my product will do. So that's how we start. And then we flip the script and we go, OK, now let's acknowledge current reality. Where are we right in this moment? What is our revenue? What is our headcount? What is what are we offering? Then a lot of the strategic planning is, OK, cool. Well, how do I get from here to there?","The transcript discusses the process of planning for businesses, starting with envisioning a desired future state and then acknowledging the current reality to strategize the path to achieve the desired state."
Taking Your Business to the Next Level Requires Moving from Ideas to Actions,"I'm picking up a like, Hey, dude, I'm gonna do the kickstart. And that's gonna like, you remind me of the 22 year old version of the entrepreneur is like, then once my Kickstarter works, then I'll be in business, Jesse. And I'm like, dude, this is in business. Just commit to it.",The speaker is encouraging someone to commit to their business idea instead of waiting for a Kickstarter campaign to be successful.
