1 hour call with Mark Zuckerberg.  We attempted to create the high school version of Facebook.,"How did you call Mark Zuckerberg and explain that story? 2005, he was some junior at Harvard. Facebook was in 10 colleges or 20 colleges. And we were like, let's start a high school version of Facebook called the business, the high list.com. And it was actually cool. We built the whole thing. We launched it. Actually, we started to see all the same trends of virality. You get to the end of the summer and he pings us and goes, Mark Zuckerberg wants to buy HS Facebook. They're launching in high schools. And he picks up the phone. Hello. And I'm like, hey, Mark. I just like sat silent for the next 45 minutes while he kind of outlined their whole strategy and most of what they did for the next 10 years.","In 2005, the speaker created a high school version of Facebook called the highlist.com. Mark Zuckerberg wanted to buy it and shared his strategy for the next 10 years."
1 trait of being a great entrepreneurï¼š worrying about what matters when it matters.,"This is one of the hallmarks of being a great entrepreneur is worrying about what matters when it matters. Example, we were starting Growth Assistant. Well, we need to figure out if it's legal to do what we're doing. And I'm like, well, no, we're not going to spend any money on that. Let's go see if there's a business here. And then if there is in a year, we'll actually have the resources to figure out if it's legal and how to make it legal, which is exactly what we ended up doing. And I think people who join a five person company, they generally are not going to walk in and go, I need a laptop and I need a T-shirt and I need lots of proper health. I don't know, man. They get it. And you just have to be honest.","Being a great entrepreneur means prioritizing what matters. For example, when starting Growth Assistant, they focused on building the business first before worrying about legalities. Joining a small company requires understanding and honesty."
3 Lessons From My Immigrant Entrepreneur Dad,"Here are three lessons I learned from my immigrant entrepreneur dad. Lesson one, the customer always comes first. One time when I was a kid, I answered the phones at his office and I said, oh, he's busy right now. And he took me in the room and said, you never tell a customer I'm busy. Tell them I'm on the other line and call them back as soon as possible. Lesson number two was hard work can always win and set you apart. I watched my dad travel from meeting to meeting to bring in new business and it left a huge imprint on what it takes to make it successful. And lesson number three is know your numbers. Accounting is the lifeblood of any business. It's the nuts and bolts. And if you don't know your numbers, you don't know your business.","Lessons from an immigrant entrepreneur: prioritize customers, work hard to stand out, and understand the importance of accounting."
4 ways to manage your energy and succeed day in and day out #skills #entrepreneurship #business,"You don't actually have a discipline problem. What you have is an energy problem. Here are four ways to think about managing your energy a little bit better. Number one, work like a lion, not a cow. Most of us have been taught, let's wake up, let's go nine to five, sit at a desk, do the same thing over and over. People who focus on their energy think about when they get the most done and they work during those times, just like a lion waits to go get its prey. Find your zone of genius. There's actually four zones. The zone of incompetence. That's stuff you don't know how to do. The zone of competence, stuff you know how to do, like maybe drive a car. Zone of excellence. For me, that might be spreadsheets. But zone of genius is something that not only am I good at, like the zone of excellence, but also gives me energy. Think yes and not either or. And last but not least, make sure that you're enjoying the people you work around. When you work with people you love, it's just fun every day and you don't have to worry about.","Managing energy is key to productivity. Focus on working during your most productive times, find your zone of genius, think yes and not either or, and enjoy working with people you love."
5 things in your To-Do List you don't needï¼Ÿ Do this instead.,"actionable, personal challenge to the audience. Just remove the bottom five items on your to-do list. Whatever's on your to-do list right now, pull it out and just like, I'm not going to do these this week or next week. I'm not going to guilt myself. I'm going to focus on these top three or five that I actually have to focus on and I'm going to do a better job of those. It's funny how when you remove the kind of BS seven out of 10 tasks, you get a whole lot better at the top ones. Totally.","The speaker suggests removing unimportant tasks from the to-do list to focus on the top priorities, leading to better performance."
7 Books that changed my life #goodreads #books #knowledge,"Entrepreneurs, here's seven books that changed my life. Number one, two, and three is my favorite genre of book, Entrepreneur Bios. Losing My Virginity by Richard Branson, where he just talks about how crazy he was to start an airline and his record label. Shoe Dog, number two, the story of Nike. Nike seems like a big company today, but back then he was flying back and forth to Japan and trying to sell knockoff shoes. And number three is Made in America by Sam Walton, the story of Walmart. Number four and number five are books that taught me some new skills. Influenced by Robert Cialdini, he talks about some of the core principles that influence people via marketing and sales. It's a must read for anybody who's gonna be an entrepreneur. Number five is The Hard Thing About Hard Things. Here's a book where it really describes how tough it is to be a startup CEO and what you're gonna encounter. Number six, The Great CEO Within. It is by far the best guide of day-to-day running a company I have ever read. It has specific tips and is written by someone who really knows the job inside and out. Number seven, my all-time most life-changing favorite book is 15 Commitments of Conscious Leadership.","The transcript discusses seven books that have had a significant impact on the speaker's life as an entrepreneur, including biographies, skill-building books, and guides for running a company."
"B2B is Easier Than B2C, Here's Why.","And one of the beauties of B2B anything, like the original business of Ampush, we got on a whiteboard. I drew a grid for 20 slides. We mocked up a story about how Facebook was going to take over the world and how we were the best in the world at Facebook. And we went and we just said, we went to LinkedIn and said, hey, will you meet with us? Will you meet with us? Hey, Daily Deals, hey, gaming companies. Like we knew who was spending on it. And after 10 phone calls, two said yes. And guess what? We had a business, right? And so that's the one thing about B2B that I think is beautiful is you can just get on the phone and start pitching people. You see their reactions, you get their feedback. It's in some ways it's way easier than B2C.","Ampush started their B2B business by pitching to companies like LinkedIn and Daily Deals, and after 10 phone calls, they had a successful business."
Being a Better Version Of Yourself by Overcoming Fear and Embracing Growth,"What's the biggest difference between Jesse from 2016 and Jesse today? The ability to know when I'm feeling threat or when I'm constricted or I'm not open and to be able to actually stop myself in the moment to make that switch. I think I'm better at communicating than I was then. I think I spent most of my time operating out of fear in 2016 and prior and now I spend significantly less time operating out of fear. I still spend a lot of time operating out of fear, but a lot more time in my genius and things that I think learning mode and being open, wanting to help people, just things that are not about fear.","Jesse has improved in recognizing and managing his emotions, communicating better, and spending less time operating out of fear."
Best career path for 2023 #growth #business #marketing #skilldevelopment,"20 years ago, everyone knew software engineering was important. They couldn't find a software engineer and nobody quite understood how it worked. Billion dollar companies like Wipro, even Accenture to some degree, that's all they do, essentially. They find offshore engineers. We think the same thing is going to happen in growth marketing, which is part of the thesis there. You know, what I tell people is it's a new discipline. You know, there's like investment banking and trading, and they're very quantitative, analytical people, and that's what they do. There's like traditional marketers who are creative. There's like Internet people who are hustly. And you kind of need all those things in one skill set.","The importance of software engineering 20 years ago is compared to the emerging field of growth marketing, which requires a combination of quantitative analysis, creativity, and hustle."
Building A Community and Maximizing Your Impact on Twitter,"I think a couple of learnings on Twitter, I'd say the first one is I would not start by writing threads. That's like one of the first things I tell people. It's a little bit of the tree falling in the forest thing. Like if you have 200 followers or even 1,000 followers and you start writing threads, there's no one there to hear, you know, the tree fall sort of thing. And so I advise people really build up yourself to probably 2,000 to 3,000 by engaging with the community. Like really get to be part of that community so that there's a bunch of people who are following you because they've seen you say smart things and like what you're talking about. Then I would try a couple single tweet type things. And then I would probably start writing threads. Obviously there's some art to writing something that's kind of gets people emotional and gets the curiosity. And that's a real art.","Starting on Twitter, it is advised to engage with the community and build up a following before writing threads. Crafting emotional and intriguing content is key."
Building Your Business By Solving a Common Problem,"The term bloating is searched more often than the term erectile dysfunction. And one doctor came to us and she said, you know, one third of women suffer from bloating. It's a huge issue. Nobody's addressed it. It's a really uncomfortable feeling. There's a variety of different reasons that it could be caused by. And so we launched this brand Unbloat.me. It's a single supplement, you know, ends bloating. We launched it in January and we're close to a thousand subs already. And we're at unit economic profitability.","Unbloat.me, a supplement that addresses bloating, has gained popularity with close to a thousand subscribers and is already profitable."
Business ideas in college #entrepreneurship #money #ecommerce #wealth,"My dumbest idea I've ever had was self-erasing chalkboards. We used to sit in college with my co-founders and I'd be like, dude, this professor's spending like 10 minutes of this class and we're paying an inordinate amount of money for erasing the freaking chalkboard. And then, you know, those chalkboards that go by each other. I was like, there should be a button that pushes an eraser so that when he does this, it just in one fell swoop swipes it. The only lesson I would tell anyone from that, look for problem. Like I was just sitting there in class going like, there's a problem. This seems really dumb. That to me is a great place to start any kind of business ideation process.","The speaker's dumbest idea was self-erasing chalkboards, which led to the realization that identifying problems is a good starting point for business ideas."
Cashflow is king #entrepreneurship #money #business,Thank you for watching!,The speaker expresses gratitude for the audience's attention.
Changing Landscapes and Empowering Your Team With AI,"Are you planning for AI this year within your businesses? A hundred percent. It's showing up everywhere for us. I had a conversation with Adrian as we were thinking about value add initiatives for customers. And I said, what if we trained all the Philippines talent on the top three to five AI tools? Imagine someone shows up and they go, Oh yeah, I know how to use Jasper. I know how to use chat GPT three. Just tell me what you need. And so, boom, that's an entire value prop. And to me, if we launch more brands, we're absolutely going to be leveraging parts of this.","AI is being incorporated into businesses, with plans to train talent on top AI tools to provide value to customers and potentially launch more brands."
Compound interest calculator. #investing #money #wealth #entrepreneur,"I just think people still don't understand how powerful compounding is. Go to Compound Interest Calculator on Google, but let's say you're 35 or 30, put a million bucks in, you add $100,000 to it every year, and you compound it at 8%. When you're 65, how much money do you think you'll have? Three, four million? 23 million. Oh, shit. Exactly.","The speaker emphasizes the power of compounding by using a compound interest calculator example, showing that investing a million dollars with yearly additions can result in 23 million dollars by age 65."
Debunking Common Misconceptions and The Realities of Being a Startup Founder,What are the biggest myths or misconceptions that people have about startup founders? I feel like my biggest misconception before I was an entrepreneur and then the one I hear the most often is that they know what they're doing. Like that they actually have some skill or some special secret sauce versus just like no idea and every day you're like figuring it out as you go and you're curious and you ask questions.,"The biggest misconception about startup founders is that they know what they're doing. In reality, they are constantly figuring things out and asking questions."
Do We Really Need Meetingsï¼Ÿ,"What I'm saying to myself is like, why do you need a meeting for that? Why do you need the time spent to actually talk about it? Yeah, I don't think you need it. I think I like it. And I think having the Bali and then having the accountability and everybody seeing what's going on and the connectivity is valuable. I've learned as I've gotten older, you know, I don't argue for what's right and wrong. It's a waste of time. I wish I could look at a dashboard, but like I got kids. I'm giving them breakfast and taking them to school. So for me, no matter what time has to be blocked on my calendar to do something. So if I think you're going to get value out of it, also by hearing my feedback by other people, then I think we should do a meeting. Now, if meetings become stupid, like I'm also the first person to look at a meeting the next day and go, guys, I don't think we need this anymore.",The speaker questions the necessity of meetings and values transparency and accountability. They prioritize time management and only advocate for meetings that provide value.
Don't Let Perfectionism Hold You Back. Start Testing Your Ideas Now.,"I often just find entrepreneurs getting stuck with either overbaking their idea before they actually go into the world or like severely underbaking it and not being realistic with themselves. And I'll just oftentimes find myself asking like, well, have you, have you sold this to any customers? Like, no, I talked to 10 and I validated, I'm like, but have you pitched it to them? Have you asked them for money? No, I haven't. And so even for those listening who aren't maybe entrepreneurs, you said it and I want to just say it again. What is the cheapest, fastest way you can get anything going and you can start to try anything? And I think that question isn't just a, for a founder, but it's, it's for especially employees at startups. When someone talks about an idea, your immediate things, you go cheapest, fastest, cheapest, fastest, and try to go figure out whether or not that there's a there.","The transcript emphasizes the importance of entrepreneurs validating their ideas by selling and pitching to customers, and encourages individuals to adopt a mindset of finding the cheapest and fastest way to test ideas."
Embracing Change and Having a Fresh Start For New Challenges,"You're going from being a one-person company to a five-person company to a 20-person company. And a 20 and a five are completely different companies. The way they operate is different. The way communication flows is different. The way sales works is different. Just everything is different. When you promote someone, one of the classic things you coach them on, or I do at least, is, hey, this is a different job. You've been promoted. Go home for the weekend. Update your LinkedIn. When you come in, pretend as if you never worked here before. Because the biggest challenge people have when they're transitioning roles, they keep doing their old job or they keep thinking in their old ways, and you really want them to think in the new way as if they came in from another organization. And then the number one person who has to do that is the CEO, because the job is just so different.","Transitioning from a small to a larger company requires a shift in mindset and approach. This is especially true for the CEO, as the role is drastically different."
Entrepreneurship Cheat Code - The Entrepreneur Mindset Shift #business #entrepreneurship #skills,"After running a company of you know, close to 200 people for eight, nine years, I think I got back into kind of entrepreneurship gear took me a few months, because I was used to like having, you know, CEO and an office manager and assistant and people to do work. And it took me a few months. But then I got back to like, No, wait, if you want to get something done, like I can launch a Wix website in a day like I got back to the kind of just move really fast and get stuff done, being able to make progress on a lot of fronts in a very short period of time.","The speaker reflects on transitioning from running a large company to being an entrepreneur again, emphasizing the ability to quickly accomplish tasks and make progress on multiple fronts."
Every CEO and Founder needs to understand this!  #entrepreneurship #money #business,"One of the things I tell every CEO I work with, if you had a test, the curve is a 22 out of 100. That's the average. If you grade yourself on a 90 out of 100, like, you know, normally getting an A is 90 out of 100. And usually people who choose to be CEOs are people who like A's. You're going to feel like you're failing every day, which you kind of are. But once you baseline that as the role, then it's like, oh, OK, this is a lot easier.","CEOs should expect to feel like they are failing every day, as the average performance in their role is only 22 out of 100."
"Facebook, Instagram, TikTok, YouTube are spying on youï¼Ÿ  #socialmedia #cookies #developer","Facebook, Instagram, and TikTok are not listening to you. What they're actually doing is much more effective. What's actually happening is let's say that you and I go get lunch together. Well, we both bring our devices with us, and we have a browsing history on both of our devices. I might have looked at couches, you might have looked at mortgages, and we sit down for an hour. Now, Facebook technically knows that our two phones were next to each other for a period of time. So since they know that they can guess that we probably talked about a lot of topic, maybe we talked about mortgages, maybe we talked about mattresses. So they'll actually show us each other's browsing history via ads, guessing that we probably talked about one of those things with each other. Now, this is where our brain comes into play. There's a cognitive bias known as the Bader-Manoff phenomenon. You know, when you buy a new pair of shoes, all of a sudden start noticing those shoes or that car everywhere? That's actually a brain cognitive bias that makes you pay attention to something because you now have it. Well, once you've been to a website or you had a copy conversation with your friend, you're much more likely to notice the mattress ad or the mortgage ad because it came up in your conversation.","Facebook, Instagram, and TikTok use browsing history and proximity data to show users ads based on their conversations, leveraging the Bader-Manoff phenomenon to increase attention and engagement."
Firing people is hard but necessary #entrepreneurship #money #business,"Netflix did that great thing of we're a team, not a family. If you're going to tell people you're a family, you got to behave like family. Family doesn't fire people. They find other things for them to do. And there are companies, by the way, that operate like there's nothing wrong with that. But if you're going to run your business, you have investors. If you're trying to hit ambitious targets, you know, you can be an optimist, but you also have to explain we're a team and baseball players love each other. They'll win a team and then the next day they'll get traded. And it works because everybody kind of understands what they're signing up for.","Netflix operates as a team, not a family, and believes in finding new roles for employees instead of firing them. This approach aligns with their ambitious targets and investor expectations."
"Generative AI applications are dominating the markets, the next opportunity for investors","Investors are plowing capital into generative AI right now. Jasper AI just raised $125 million at a $1.5 billion valuation. It's only two years old, by the way, the company's only two years old. I thought of AI as a how, we're going to use it in each of the businesses, but not necessarily build a business around it. So I think at minimum, if you're a services business, whatever you are, use AI at the core. I think it's going to become a critical part of any kind of business building. 30 years ago, businesses didn't rely on engineering at all. And now it's just core to every business. I think the same thing will happen with AI generally. And so getting smart on it's super important.","Jasper AI raises $125 million in funding, highlighting the growing interest in generative AI. AI is becoming essential for businesses and will likely follow the same trajectory as engineering did 30 years ago."
How does AI worksï¼Ÿ #gpt3 #openai #chatgpt,"The reality of all AI, just so everybody knows, is all it's doing is it just looks at lots of data and uses a bunch of historical things that have happened, like which word follows which word in a sentence, and then predicts that that's likely to be the word. And I think that's everyone, by the way, deals with AI every day, which is when you're texting, the auto suggest is essentially an AI. It's basically saying, based on the sentence you're writing, here's what I think is going to be the next word that you should put. And then, of course, they give you a few options. And then, by the way, on average, which option you pick, they then learn, and the learning gets better and smarter.","AI uses historical data to predict the next word in a sentence, as seen in auto-suggest features. It learns and improves based on user choices."
How I Discovered GrowthAssistant and How It Revolutionized Workflows,"My first job was in consulting and, you know, I was sitting there making slides one day and my manager looks across and he goes, Hey, you don't need to be doing that. You can just write them on a page and send them to India overnight and you'll wake up the next morning and the slides will be done for you. And I was 22 or 23 and I was like, Oh, this is amazing. And so when we started Ampush, one of the first things I did was I said, we're going to build an offshore team that's going to handle a lot of the manual work associated with running ads. And that team is now 50 plus people. And, and, you know, we'd have people who'd work at Ampush for a few years and leave to go do growth at a brand. And they would call me and go, man, I need that team. And I said, well, yeah, isn't there, there's nobody who you can offshore that too. They go, that doesn't exist. And so we started this business called growth assistant and it's, it's grown. I mean, we have over 200 people in the Philippines already and over a hundred customers. A hundred customers already? In like 18, less than 18 months. And I think now I, now I view growth marketing as the next computer science.","Ampush CEO discusses the growth of their offshore team and the success of their business, Growth Assistant, which provides growth marketing services with over 200 employees and 100 customers in less than 18 months."
How I Find Great Entrepreneurs,"How do you find these people to partner with? What criteria do you use or how are you able to judge them effectively? One of my favorite entrepreneurial kind of criteria is we call it like entrepreneurial rigor. There's rigorous, which is you're analytical, you're quantitative, you're thoughtful and reflective. And then there's entrepreneurial, which is like you're bold and resourceful. And we actually think the best people cross over those two.","The speaker looks for partners who possess both analytical and entrepreneurial qualities, as they believe the best people have a combination of both."
